{"protocol_version":1,"game_id":"game_fixture","turn_id":"turn_bid","phase":"bidding","seat":"seat_1","seat_index":1,"hand":["3","A"],"landlord_cards_public":[],"action_history":[],"remaining_card_counts":{"seat_0":17,"seat_1":17,"seat_2":17},"legal_actions":[{"id":100,"cards":[],"type":"bid","bid":0}],"base_stake":500,"current_multiplier":1,"arena_token_balance":8300,"decision_timeout_ms":8000}
