{"protocol_version":1,"game_id":"game_fixture","turn_id":"turn_fixture","phase":"playing","seat":"landlord","seat_index":0,"hand":["3","A"],"landlord_cards_public":[],"action_history":[],"remaining_card_counts":{"landlord":2,"farmer_left":1,"farmer_right":1},"legal_actions":[{"id":0,"cards":[],"type":"pass"},{"id":18,"cards":["A"]}],"base_stake":500,"current_multiplier":2,"arena_token_balance":8300,"decision_timeout_ms":8000}
